<?xml version="1.0" encoding="utf-8"?>
<Lesson xmlns="http://orthoeman.org/" xmlns:xsi="http://www.w3.org/2001/XMLSchema-instance" title="Template Title" xsi:schemaLocation="http://orthoeman.org/orthoeman.xsd">
  <Abstract>Little info describing the Lesson.Lorem ipsum dolor sit amet, consectetur adipisicing elit, sed do eiusmod tempor incididunt ut labore et dolore magna aliqua. Ut enim ad minim veniam, quis nostrud exercitation ullamco laboris nisi ut aliquip ex ea commodo consequat. Duis aute irure dolor in reprehenderit in voluptate velit esse cillum dolore eu fugiat nulla pariatur. Excepteur sint occaecat cupidatat non proident, sunt in culpa qui officia deserunt mollit anim id est laborum</Abstract>
    <Page grade="10">
            <Image id="3" enableTracking="no" showRegions="yes" width="480" height="640">
                <Polygon isHotSpot="yes">
                    <Point x="235" y="131"/>
                    <Point x="192" y="221"/>
                    <Point x="122" y="302"/>
                    <Point x="150" y="374"/>
                    <Point x="230" y="318"/>
                    <Point x="289" y="219"/>
                </Polygon>
            </Image>
            <Text>Identify ( Point)  the position of the fracture on the Xray</Text>
    </Page>
    <Page positiveGrade="30" negativeGrade="20">
            <Image id="4" enableTracking="yes" showRegions="no" width="482" height="214" />
            <RangeQuiz maxValue="410" minValue="390">
                <Question>Find the largest value of the force exerted on the forefoot:</Question>
            </RangeQuiz>
    </Page>
    <Page positiveGrade="30" negativeGrade="20">
            <Video>
                <Source id="2" type="video/mp4" />
                <Source id="3" type="video/webm" />
            </Video>
        <Quiz>
            <Question>Is the biomechanic behaviour consistent with the clinic of the patient?</Question>
            <Answer isCorrect="yes">Yes</Answer>
            <Answer isCorrect="no">No</Answer>
        </Quiz>
    </Page>

  <Page positiveGrade="30" negativeGrade="20">
      <Image id="5" enableTracking="no" showRegions="no" width="480" height="640" />
    <Quiz>
      <Question>Which is the type of the fracture?</Question>
      <Answer isCorrect="no">Femoral head</Answer>
      <Answer isCorrect="yes">Femoral neck, Pauwels  III</Answer>
      <Answer isCorrect="no">Trochanteric region</Answer>
      <Answer isCorrect="no">Femoral neck, Pauwels  II</Answer>
    </Quiz>
  </Page>
  <Page positiveGrade="30" negativeGrade="20">
      <Image id="9" showRegions="yes" enableTracking="no" width="480" height="640">
        <Circle isHotSpot="yes" radius="35">
          <Center x="189" y="152"/>
        </Circle>
          <Rectangle isHotSpot="yes" width="60" height="80">
              <Point x="5" y="5"/>
          </Rectangle>
        <Ellipse isHotSpot="yes" radiusX="40" radiusY="60">
          <Center x="416" y="498"/>
        </Ellipse>
      </Image>
      <Text>Point the two radiological findings concerning the 6.5 mm screw:( the 6.5 mm screw is the smallest one)</Text>
  </Page>
  <Page positiveGrade="30" negativeGrade="20">
      <Image id="11" enableTracking="no" showRegions="yes" width="480" height="640">
        <Circle isHotSpot="yes" radius="50">
          <Center x="133" y="173"/>
        </Circle>
      </Image>
      <Text>Point  the radiological finding concerning the dynamic screw:( the dynamic screw is the largest one).</Text>
  </Page>
  <Page positiveGrade="30" negativeGrade="20">
      <Image id="2" enableTracking="no" showRegions="yes" width="480" height="640">
        <Circle isHotSpot="no" radius="35">
          <Center x="189" y="152"/>
        </Circle>
        <Ellipse isHotSpot="no" radiusX="40" radiusY="60">
          <Center x="416" y="498"/>
        </Ellipse>
      </Image>
    <Quiz>
      <Question>Which of the following answers are correct:</Question>
      <Answer isCorrect="yes">The tip of the dynamic screw is situated much  too close to the superior border of the femoral head ( the dynamic screw is the largest one)</Answer>
      <Answer isCorrect="yes">The compression screw is not completely tightened, so compression is incomplete</Answer>
      <Answer isCorrect="no">The  thread of the dynamic screw is situated within the fracture</Answer>
      <Answer isCorrect="no">The dynamic screw screw is too short</Answer>
    </Quiz>
  </Page>
  <Page positiveGrade="30" negativeGrade="20">
      <Image id="2" enableTracking="no" showRegions="yes" width="1023" height="732">
        <Ellipse isHotSpot="yes" radiusX="70" radiusY="40">
          <Center x="446" y="407"/>
        </Ellipse>
      </Image>
      <Text>Identify (Point) the position of the patient Center of mass.</Text>
  </Page>
  <Page positiveGrade="30" negativeGrade="20">
      <Image id="3" enableTracking="no" showRegions="yes" width="1023" height="732" />
    <Quiz>
      <Question>Do you observe any anomaly in left-right dividing of the percentage of the body weight?</Question>
      <Answer isCorrect="no">No</Answer>
      <Answer isCorrect="no">yes, the distribution is higher for the left side</Answer>
      <Answer isCorrect="yes">yes, the distribution is higher for the right side</Answer>
    </Quiz>
  </Page>
  <Page positiveGrade="30" negativeGrade="20">
      <Image id="2" enableTracking="no" showRegions="yes" width="1024" height="734" />
    <Quiz>
      <Question>Please indicate the region that has an abnormal contact percentage:</Question>
      <Answer isCorrect="no">Rearfoot</Answer>
      <Answer isCorrect="yes">Midfoot</Answer>
      <Answer isCorrect="no">Forefoot</Answer>
    </Quiz>
  </Page>
</Lesson>
